{"benchmark_id":"EZ-B002","edition_id":"AME2020","feature_policy_hash":"c01e6be793bbd3c71e3cd0cf2ba7f7746111e073f88d54e30be1ffcfcf25c3d6","feature_policy_id":"ez-b002-identity-zn-v1","ground_truth_policy":"ez-gt-policy-v1:evaluated_non_estimated_only","leakage_rule":"targets are the eligible nuclei inside the region and training is the eligible nuclei outside it; target masses enter no fit, no feature, no hyperparameter, and no uncertainty calibration. Target identities (Z, N, A) are allowed.","n_eligible":427,"n_targets":20,"n_training":407,"normalizer_version":"ez-norm-v2","parser_version":"ame-parser-v2","protocol_version":"1.0.0","raw_source_hash":"94cff436bf38c6b0acec35d96f6d35cd4c7dfa71959b97dc4347648abaa4a75a","region":{"n_max":46,"n_min":42,"region_id":"rect-Z33-36-N42-46","type":"rectangle","z_max":36,"z_min":33},"region_id":"rect-Z33-36-N42-46","region_manifest_hash":"9b7d97fdbd617eb550415c385cc42d8f11af7179bba29d431712cbaa471a5976","region_policy_id":"ez-b002-region-types-v1","split_digest":"aa76ce9877c42664f7fe1d76936c58bfd6612ee0f1791dfd5a760481460eaf18","split_digest_rule":"ez-b002-split-digest-v1: sha256 of canonical JSON of {feature_policy_hash, raw_source_hash, region_manifest_hash, target_identity_digest, training_identity_digest}","split_id":"rect-Z33-36-N42-46@aa76ce9877c42664","split_policy_id":"ez-b002-geographic-split-v1","supported_sides":["n_high","n_low","z_high","z_low"],"target_identity_digest":"2ac2645344821dd1bd7b85017a55e1f0460b53f5cecd78791576f84454090eca","target_nuclide_ids":["Z33-N42","Z33-N43","Z33-N44","Z33-N45","Z33-N46","Z34-N42","Z34-N43","Z34-N44","Z34-N45","Z34-N46","Z35-N42","Z35-N43","Z35-N44","Z35-N45","Z35-N46","Z36-N42","Z36-N43","Z36-N44","Z36-N45","Z36-N46"],"training_identity_digest":"abfe4ac34ae7d03032f0e6548a02277250750d006137abef0e6dbb29763195ff","training_nuclide_ids":["Z10-N10","Z10-N11","Z10-N12","Z10-N13","Z10-N9","Z11-N10","Z11-N11","Z11-N12","Z11-N13","Z11-N14","Z12-N11","Z12-N12","Z12-N13","Z12-N14","Z12-N15","Z13-N12","Z13-N13","Z13-N14","Z13-N15","Z13-N16","Z14-N14","Z14-N15","Z14-N16","Z14-N17","Z14-N18","Z15-N14","Z15-N15","Z15-N16","Z15-N17","Z15-N18","Z15-N19","Z15-N20","Z16-N15","Z16-N16","Z16-N17","Z16-N18","Z16-N19","Z16-N20","Z17-N16","Z17-N17","Z17-N18","Z17-N19","Z17-N21","Z17-N22","Z18-N18","Z18-N20","Z18-N21","Z18-N22","Z18-N23","Z18-N24","Z19-N19","Z19-N20","Z19-N21","Z19-N22","Z19-N23","Z19-N24","Z19-N25","Z20-N20","Z20-N21","Z20-N22","Z20-N23","Z20-N24","Z20-N25","Z20-N26","Z21-N22","Z21-N23","Z21-N24","Z21-N25","Z21-N26","Z21-N27","Z21-N28","Z22-N23","Z22-N24","Z22-N25","Z22-N26","Z22-N27","Z22-N28","Z22-N29","Z23-N24","Z23-N25","Z23-N26","Z23-N27","Z23-N28","Z23-N29","Z23-N30","Z24-N26","Z24-N27","Z24-N28","Z24-N29","Z24-N30","Z24-N31","Z24-N32","Z25-N27","Z25-N28","Z25-N29","Z25-N30","Z25-N31","Z25-N32","Z25-N33","Z26-N28","Z26-N29","Z26-N30","Z26-N31","Z26-N32","Z26-N33","Z26-N34","Z27-N30","Z27-N31","Z27-N32","Z27-N33","Z27-N34","Z27-N35","Z27-N36","Z28-N31","Z28-N32","Z28-N33","Z28-N34","Z28-N35","Z28-N36","Z28-N37","Z29-N33","Z29-N34","Z29-N35","Z29-N36","Z29-N37","Z29-N38","Z29-N39","Z30-N33","Z30-N34","Z30-N35","Z30-N36","Z30-N37","Z30-N38","Z30-N39","Z30-N40","Z30-N41","Z31-N35","Z31-N36","Z31-N37","Z31-N38","Z31-N39","Z31-N40","Z31-N41","Z31-N42","Z32-N36","Z32-N37","Z32-N38","Z32-N39","Z32-N40","Z32-N41","Z32-N43","Z32-N44","Z33-N38","Z33-N39","Z33-N40","Z34-N39","Z34-N41","Z34-N47","Z35-N41","Z35-N47","Z35-N48","Z35-N49","Z36-N47","Z36-N48","Z36-N49","Z36-N50","Z37-N44","Z37-N45","Z37-N46","Z37-N47","Z37-N48","Z37-N49","Z37-N50","Z37-N51","Z37-N52","Z38-N46","Z38-N47","Z38-N48","Z38-N49","Z38-N50","Z38-N51","Z38-N52","Z38-N53","Z38-N54","Z39-N47","Z39-N48","Z39-N49","Z39-N50","Z39-N51","Z39-N52","Z39-N53","Z39-N54","Z39-N55","Z40-N49","Z40-N50","Z40-N51","Z40-N52","Z40-N53","Z40-N54","Z40-N55","Z40-N56","Z40-N57","Z41-N50","Z41-N51","Z41-N52","Z41-N53","Z41-N54","Z41-N55","Z41-N56","Z41-N57","Z41-N58","Z42-N52","Z42-N53","Z42-N54","Z42-N55","Z42-N56","Z42-N57","Z42-N58","Z42-N59","Z42-N60","Z43-N54","Z43-N55","Z43-N56","Z43-N57","Z43-N58","Z43-N59","Z43-N60","Z43-N61","Z43-N62","Z44-N55","Z44-N56","Z44-N57","Z44-N58","Z44-N59","Z44-N60","Z44-N61","Z44-N62","Z44-N63","Z45-N56","Z45-N57","Z45-N58","Z45-N59","Z45-N60","Z45-N61","Z45-N62","Z45-N63","Z45-N64","Z45-N65","Z46-N58","Z46-N59","Z46-N60","Z46-N61","Z46-N62","Z46-N63","Z46-N64","Z46-N66","Z46-N67","Z46-N68","Z47-N60","Z47-N61","Z47-N62","Z47-N63","Z47-N65","Z47-N66","Z47-N67","Z47-N68","Z47-N69","Z47-N70","Z48-N61","Z48-N62","Z48-N64","Z48-N65","Z48-N66","Z48-N67","Z48-N68","Z48-N69","Z48-N70","Z48-N71","Z49-N63","Z49-N64","Z49-N65","Z49-N66","Z49-N67","Z49-N68","Z49-N69","Z49-N70","Z49-N71","Z49-N72","Z49-N73","Z50-N65","Z50-N66","Z50-N67","Z50-N68","Z50-N69","Z50-N70","Z50-N71","Z50-N72","Z50-N73","Z50-N74","Z50-N75","Z51-N67","Z51-N68","Z51-N69","Z51-N70","Z51-N71","Z51-N72","Z51-N73","Z51-N74","Z51-N75","Z51-N76","Z51-N77","Z52-N69","Z52-N70","Z52-N71","Z52-N72","Z52-N73","Z52-N74","Z52-N75","Z52-N76","Z52-N77","Z52-N78","Z52-N79","Z53-N70","Z53-N71","Z53-N72","Z53-N73","Z53-N74","Z53-N75","Z53-N76","Z53-N77","Z53-N78","Z53-N79","Z53-N80","Z54-N72","Z54-N73","Z54-N74","Z54-N75","Z54-N76","Z54-N77","Z54-N78","Z54-N79","Z54-N80","Z54-N81","Z54-N82","Z55-N74","Z55-N75","Z55-N76","Z55-N77","Z55-N78","Z55-N79","Z55-N80","Z55-N81","Z55-N82","Z55-N83","Z55-N84","Z56-N76","Z56-N77","Z56-N78","Z56-N79","Z56-N80","Z56-N81","Z56-N82","Z56-N83","Z56-N84","Z56-N85","Z56-N86","Z57-N78","Z57-N79","Z57-N80","Z57-N81","Z57-N82","Z57-N83","Z57-N84","Z57-N85","Z57-N86","Z57-N87","Z57-N88","Z58-N80","Z58-N81","Z58-N82","Z58-N83","Z58-N84","Z58-N85","Z58-N86","Z58-N87","Z58-N88","Z58-N89","Z6-N4","Z6-N5","Z6-N6","Z6-N7","Z6-N8","Z7-N5","Z7-N6","Z7-N7","Z7-N8","Z7-N9","Z8-N10","Z8-N11","Z8-N7","Z8-N8","Z8-N9","Z9-N10","Z9-N11","Z9-N12","Z9-N8","Z9-N9"],"z_band":"medium"}
